///gtfo||||
///Character|Line|Timing|Connection (block name - FOR PLAYER ONLY)|Effects
legacy|Is that a humvee?!|||
oorah|I got shotgun...literally hehehehe.|||
giant|Anyone want a window seat? |||
Nerd|Medusozoa Tracers specifically lock onto 4WD vehicles. We should escape on foot!|1||
Aloof Sniper|I'd prefer staying boots-on-the-ground.|||
Mystic|Release me from this jelly-sapien mortal coil.|||
Player|Take the Humvee!|5|C1|
Player|Let's stay on foot!|4|XB9-2|
C.O.|We should make a decision soon...|10||
